{
  "address": "0xeef5e2d8255e973d587217f9509b416b41ca5870",
  "chainId": 11155111,
  "name": "Xeenus",
  "symbol": "XEENUS",
  "decimals": 18,
  "subscription": {
    "tier": 1,
    "expiresAt": "2099-12-31"
  },
  "verified": true,
  "logo": "assets/tokens/11155111/0xeef5e2d8255e973d587217f9509b416b41ca5870.png",
  "project": {
    "name": "Xeenus Token",
    "description": "Test ERC20 token for development and testing purposes"
  },
  "links": [
    { "name": "GitHub", "url": "https://github.com/bokkypoobah/WeenusTokenFaucet", "description": "Weenus Token Faucet repository" }
  ],
  "tags": ["testnet", "faucet", "development"]
}
