{
  "address": "0x2823589ae095d99bd64deea80b4690313e2fb519",
  "chainId": 11155111,
  "name": "Weenus",
  "symbol": "WEENUS",
  "decimals": 18,
  "subscription": {
    "tier": 3,
    "expiresAt": "2099-12-31"
  },
  "verified": true,
  "logo": "assets/tokens/11155111/0x2823589ae095d99bd64deea80b4690313e2fb519.png",
  "profile": "profiles/tokens/11155111/0x2823589ae095d99bd64deea80b4690313e2fb519.md",
  "project": {
    "name": "Weenus Token",
    "description": "Test ERC20 token for development and testing purposes"
  },
  "links": [
    { "name": "GitHub", "url": "https://github.com/bokkypoobah/WeenusTokenFaucet", "description": "Weenus Token Faucet repository" }
  ],
  "tags": ["testnet", "faucet", "development"]
}
