{
  "address": "0x101848d5c5bbca18e6b4431eedf6b95e9adf82fa",
  "chainId": 31337,
  "name": "Weenus",
  "symbol": "WEENUS",
  "decimals": 18,
  "subscription": {
    "tier": 3,
    "expiresAt": "2099-12-31"
  },
  "verified": true,
  "profile": "profiles/tokens/31337/0x101848d5c5bbca18e6b4431eedf6b95e9adf82fa.md",
  "project": {
    "name": "Weenus Token",
    "description": "Test ERC20 token for development and testing purposes on localhost networks"
  },
  "links": [
    { "name": "GitHub", "url": "https://github.com/bokkypoobah/WeenusTokenFaucet", "description": "Weenus Token Faucet repository" }
  ],
  "tags": ["testnet", "faucet", "development"]
}
